<?xml version="1.0" encoding="UTF-8"?>

<!DOCTYPE root SYSTEM "algun.dtd"!>

<!--
    Document   : newXMLDocument.xml
    Created on : 21 de octubre de 2007, 15:07
    Author     : Mateo
    Description:
        Purpose of the document follows.
-->

<root>
    <elem1>Elemento1</elem1>
    <elem2/>
    <elem3 att1="algo1" att2="algo2">
	HH
	<![CDATA[Algo para destacar]]>
    </elem3>
    <elem3 att1="algo1" att2="algo2"/>
    <elem4>
	<otro/>
	<otro att="asd">
	    Hola
	    <algomas/>
	</otro>
    </elem4> 
</root>